{
  "snapshot_ref": "snap:demo-0001:58310",
  "intent": {
    "kind": "pass_space",
    "player": "H10",
    "target_player": null,
    "target": [
      38.0,
      -4.0,
      0.0
    ],
    "path": [
      [
        18.4,
        6.1
      ],
      [
        27.0,
        3.0
      ],
      [
        33.0,
        -1.5
      ],
      [
        38.0,
        -4.0
      ]
    ],
    "curve": 0.35,
    "power": 0.62,
    "pass_technique_override": null,
    "shot_technique_override": null,
    "source": "fan"
  },
  "horizon_s": 10.0,
  "n": 1,
  "seed": 7,
  "return_frames": true,
  "frame_stride": 1
}
